{
  "schema_version": 1,
  "id": "example-exchange",
  "star_system_id": "example-system",
  "display_name": "Example Exchange",
  "pricing_version": "example-exchange@1",
  "position_m": [
    0.0,
    1500.0,
    0.0
  ],
  "radius_m": 120.0,
  "rules": {
    "dock_range_from_surface_m": 200.0,
    "max_ship_speed_mps": 10.0,
    "sell_cooldown_s": 1,
    "price_drop_pct_per_band": 10,
    "price_floor_pct": 30,
    "recovery_interval_s": 60
  },
  "listings": [
    {
      "mineral_id": "example-ore",
      "base_price_cr_per_kg": 10,
      "band_kg": 2000,
      "recovery_kg": 1000
    },
    {
      "mineral_id": "other-ore",
      "base_price_cr_per_kg": 250,
      "band_kg": 100,
      "recovery_kg": 50
    }
  ]
}
